{"analysis":{"dcOperatingPoint":true},"backend":"native-mna","circuit":{"devices":[{"kind":"voltage-source","name":"V1","source":{"acMagnitude":1,"acPhaseDegrees":0,"dcValue":5},"terminals":[1,0]},{"kind":"resistor","name":"R1","terminals":[1,2],"value":1000},{"kind":"resistor","name":"R2","terminals":[2,0],"value":1000}],"initialConditions":{"elementCurrents":{},"nodeVoltages":{}},"nodes":[{"name":"0"},{"name":"in"},{"name":"out"}],"referenceNode":0,"schemaVersion":1,"solver":{"absoluteCurrentTolerance":1e-12,"absoluteVoltageTolerance":1e-06,"maximumIterations":100,"minimumConductance":1e-12,"nominalTemperatureCelsius":27,"relativeTolerance":0.001,"temperatureCelsius":27}},"protocolVersion":1,"requestID":"golden-native-divider"}
